{
  "id": "00000000-0000-4000-8000-000000000021",
  "claim": "Llanos heavy-oil waterfloods: analogue viscosity of 3 cP understates Cubiro; use measured 6 cP when available.",
  "scope": "discipline",
  "scope_id": "reservoir",
  "evidence": [
    "run:00000000-0000-4000-8000-000000000002"
  ],
  "author": "chris",
  "created_at": "2026-09-26T10:00:00Z",
  "status": "confirmed",
  "confidence": 0.8,
  "legal_tag": "lt-firm",
  "sanitised": true,
  "last_confirmed": "2026-09-26T10:00:00Z"
}
