{
  "id": "00000000-0000-4000-8000-000000000023",
  "claim": "Register runs on potential.js 2.0.0 are not comparable with 2.1.0.",
  "scope": "tool",
  "scope_id": "opportunity-register",
  "evidence": [
    "run:00000000-0000-4000-8000-000000000001"
  ],
  "author": "chris",
  "created_at": "2026-09-23T10:00:00Z",
  "status": "invalidated",
  "confidence": 0.9,
  "valid_to": "2026-09-27T00:00:00Z",
  "superseded_by": "00000000-0000-4000-8000-000000000021"
}
