{
  "id": "00000000-0000-4000-8000-000000000022",
  "claim": "Send data-room NDAs with a 24-month term; 12 months expired mid-evaluation twice.",
  "scope": "firm",
  "evidence": [
    "doc:00000000-0000-4000-8000-000000000011"
  ],
  "author": "dream:2026-w39",
  "created_at": "2026-09-28T02:00:00Z",
  "status": "proposed",
  "confidence": 0.6,
  "recurrence": 2
}
